{
  "schemaVersion": "tennis-ranking-export.v1",
  "provider": "WTA",
  "tour": "WTA",
  "rankingSnapshotDate": "2026-08-10",
  "extractedAt": "2026-08-20T22:43:32.470Z",
  "publicationCheckedAt": "2026-08-20T22:43:32.470Z",
  "sourceTrust": "verified",
  "ingestionMode": "public_first_party",
  "sourceUrl": "https://api.wtatennis.com/tennis/players/ranked",
  "publicationUrl": "https://www.wtatennis.com/rankings/singles",
  "scope": {
    "topN": 50,
    "nationalityCodes": [
      "AUS"
    ],
    "complete": true
  },
  "athletes": [
    {
      "name": "Aryna Sabalenka",
      "nationalityCode": "BLR",
      "points": 8670,
      "providerId": "320760",
      "rank": 1,
      "selectionReasons": [
        "top_50"
      ]
    },
    {
      "name": "Elena Rybakina",
      "nationalityCode": "KAZ",
      "points": 8316,
      "providerId": "324166",
      "rank": 2,
      "selectionReasons": [
        "top_50"
      ]
    },
    {
      "name": "Jessica Pegula",
      "nationalityCode": "USA",
      "points": 6680,
      "providerId": "316956",
      "rank": 3,
      "selectionReasons": [
        "top_50"
      ]
    },
    {
      "name": "Coco Gauff",
      "nationalityCode": "USA",
      "points": 5919,
      "providerId": "328560",
      "rank": 4,
      "selectionReasons": [
        "top_50"
      ]
    },
    {
      "name": "Iga Swiatek",
      "nationalityCode": "POL",
      "points": 5419,
      "providerId": "326408",
      "rank": 5,
      "selectionReasons": [
        "top_50"
      ]
    },
    {
      "name": "Mirra Andreeva",
      "nationalityCode": "RUS",
      "points": 5323,
      "providerId": "331809",
      "rank": 6,
      "selectionReasons": [
        "top_50"
      ]
    },
    {
      "name": "Karolina Muchova",
      "nationalityCode": "CZE",
      "points": 5048,
      "providerId": "322191",
      "rank": 7,
      "selectionReasons": [
        "top_50"
      ]
    },
    {
      "name": "Linda Noskova",
      "nationalityCode": "CZE",
      "points": 5016,
      "providerId": "329668",
      "rank": 8,
      "selectionReasons": [
        "top_50"
      ]
    },
    {
      "name": "Elina Svitolina",
      "nationalityCode": "UKR",
      "points": 4634,
      "providerId": "316738",
      "rank": 9,
      "selectionReasons": [
        "top_50"
      ]
    },
    {
      "name": "Amanda Anisimova",
      "nationalityCode": "USA",
      "points": 4353,
      "providerId": "326384",
      "rank": 10,
      "selectionReasons": [
        "top_50"
      ]
    },
    {
      "name": "Marta Kostyuk",
      "nationalityCode": "UKR",
      "points": 3830,
      "providerId": "326482",
      "rank": 11,
      "selectionReasons": [
        "top_50"
      ]
    },
    {
      "name": "Belinda Bencic",
      "nationalityCode": "SUI",
      "points": 2995,
      "providerId": "319001",
      "rank": 12,
      "selectionReasons": [
        "top_50"
      ]
    },
    {
      "name": "Naomi Osaka",
      "nationalityCode": "JPN",
      "points": 2846,
      "providerId": "319998",
      "rank": 13,
      "selectionReasons": [
        "top_50"
      ]
    },
    {
      "name": "Diana Shnaider",
      "nationalityCode": "RUS",
      "points": 2798,
      "providerId": "330482",
      "rank": 14,
      "selectionReasons": [
        "top_50"
      ]
    },
    {
      "name": "Jasmine Paolini",
      "nationalityCode": "ITA",
      "points": 2773,
      "providerId": "319280",
      "rank": 15,
      "selectionReasons": [
        "top_50"
      ]
    },
    {
      "name": "Iva Jovic",
      "nationalityCode": "USA",
      "points": 2691,
      "providerId": "332285",
      "rank": 16,
      "selectionReasons": [
        "top_50"
      ]
    },
    {
      "name": "Victoria Mboko",
      "nationalityCode": "CAN",
      "points": 2530,
      "providerId": "331006",
      "rank": 17,
      "selectionReasons": [
        "top_50"
      ]
    },
    {
      "name": "Ekaterina Alexandrova",
      "nationalityCode": "RUS",
      "points": 2506,
      "providerId": "319007",
      "rank": 18,
      "selectionReasons": [
        "top_50"
      ]
    },
    {
      "name": "Sorana Cirstea",
      "nationalityCode": "ROU",
      "points": 2502,
      "providerId": "312469",
      "rank": 19,
      "selectionReasons": [
        "top_50"
      ]
    },
    {
      "name": "Alexandra Eala",
      "nationalityCode": "PHI",
      "points": 2216,
      "providerId": "330332",
      "rank": 20,
      "selectionReasons": [
        "top_50"
      ]
    },
    {
      "name": "Anna Kalinskaya",
      "nationalityCode": "RUS",
      "points": 2083,
      "providerId": "323942",
      "rank": 21,
      "selectionReasons": [
        "top_50"
      ]
    },
    {
      "name": "Elise Mertens",
      "nationalityCode": "BEL",
      "points": 2003,
      "providerId": "317964",
      "rank": 22,
      "selectionReasons": [
        "top_50"
      ]
    },
    {
      "name": "Maja Chwalinska",
      "nationalityCode": "POL",
      "points": 1984,
      "providerId": "325639",
      "rank": 23,
      "selectionReasons": [
        "top_50"
      ]
    },
    {
      "name": "Madison Keys",
      "nationalityCode": "USA",
      "points": 1814,
      "providerId": "316959",
      "rank": 24,
      "selectionReasons": [
        "top_50"
      ]
    },
    {
      "name": "Anastasia Potapova",
      "nationalityCode": "AUT",
      "points": 1781,
      "providerId": "325601",
      "rank": 25,
      "selectionReasons": [
        "top_50"
      ]
    },
    {
      "name": "Barbora Krejcikova",
      "nationalityCode": "CZE",
      "points": 1776,
      "providerId": "318314",
      "rank": 26,
      "selectionReasons": [
        "top_50"
      ]
    },
    {
      "name": "Marie Bouzkova",
      "nationalityCode": "CZE",
      "points": 1774,
      "providerId": "320983",
      "rank": 27,
      "selectionReasons": [
        "top_50"
      ]
    },
    {
      "name": "Emma Navarro",
      "nationalityCode": "USA",
      "points": 1669,
      "providerId": "325410",
      "rank": 28,
      "selectionReasons": [
        "top_50"
      ]
    },
    {
      "name": "Ann Li",
      "nationalityCode": "USA",
      "points": 1596,
      "providerId": "326096",
      "rank": 29,
      "selectionReasons": [
        "top_50"
      ]
    },
    {
      "name": "Jelena Ostapenko",
      "nationalityCode": "LAT",
      "points": 1537,
      "providerId": "319939",
      "rank": 30,
      "selectionReasons": [
        "top_50"
      ]
    },
    {
      "name": "Leylah Fernandez",
      "nationalityCode": "CAN",
      "points": 1454,
      "providerId": "326735",
      "rank": 31,
      "selectionReasons": [
        "top_50"
      ]
    },
    {
      "name": "Maria Sakkari",
      "nationalityCode": "GRE",
      "points": 1385,
      "providerId": "318312",
      "rank": 32,
      "selectionReasons": [
        "top_50"
      ]
    },
    {
      "name": "Hailey Baptiste",
      "nationalityCode": "USA",
      "points": 1338,
      "providerId": "327101",
      "rank": 33,
      "selectionReasons": [
        "top_50"
      ]
    },
    {
      "name": "Donna Vekic",
      "nationalityCode": "CRO",
      "points": 1336,
      "providerId": "318516",
      "rank": 34,
      "selectionReasons": [
        "top_50"
      ]
    },
    {
      "name": "Sara Bejlek",
      "nationalityCode": "CZE",
      "points": 1289,
      "providerId": "330375",
      "rank": 35,
      "selectionReasons": [
        "top_50"
      ]
    },
    {
      "name": "Xinyu Wang",
      "nationalityCode": "CHN",
      "points": 1248,
      "providerId": "326376",
      "rank": 36,
      "selectionReasons": [
        "top_50"
      ]
    },
    {
      "name": "Janice Tjen",
      "nationalityCode": "INA",
      "points": 1238,
      "providerId": "328818",
      "rank": 37,
      "selectionReasons": [
        "top_50"
      ]
    },
    {
      "name": "Cristina Bucsa",
      "nationalityCode": "ESP",
      "points": 1224,
      "providerId": "321158",
      "rank": 38,
      "selectionReasons": [
        "top_50"
      ]
    },
    {
      "name": "Nikola Bartunkova",
      "nationalityCode": "CZE",
      "points": 1203,
      "providerId": "330364",
      "rank": 39,
      "selectionReasons": [
        "top_50"
      ]
    },
    {
      "name": "Jaqueline Cristian",
      "nationalityCode": "ROU",
      "points": 1191,
      "providerId": "320319",
      "rank": 40,
      "selectionReasons": [
        "top_50"
      ]
    },
    {
      "name": "Magdalena Frech",
      "nationalityCode": "POL",
      "points": 1185,
      "providerId": "320277",
      "rank": 41,
      "selectionReasons": [
        "top_50"
      ]
    },
    {
      "name": "Clara Tauson",
      "nationalityCode": "DEN",
      "points": 1184,
      "providerId": "327793",
      "rank": 42,
      "selectionReasons": [
        "top_50"
      ]
    },
    {
      "name": "Liudmila Samsonova",
      "nationalityCode": "RUS",
      "points": 1178,
      "providerId": "322222",
      "rank": 43,
      "selectionReasons": [
        "top_50"
      ]
    },
    {
      "name": "Katerina Siniakova",
      "nationalityCode": "CZE",
      "points": 1170,
      "providerId": "320301",
      "rank": 44,
      "selectionReasons": [
        "top_50"
      ]
    },
    {
      "name": "Daria Snigur",
      "nationalityCode": "UKR",
      "points": 1163,
      "providerId": "327845",
      "rank": 45,
      "selectionReasons": [
        "top_50"
      ]
    },
    {
      "name": "Oleksandra Oliynykova",
      "nationalityCode": "UKR",
      "points": 1154,
      "providerId": "327182",
      "rank": 46,
      "selectionReasons": [
        "top_50"
      ]
    },
    {
      "name": "Tamara Korpatsch",
      "nationalityCode": "GER",
      "points": 1128,
      "providerId": "319571",
      "rank": 47,
      "selectionReasons": [
        "top_50"
      ]
    },
    {
      "name": "Lilli Tagger",